{
    "schema":  1,
    "bank_version":  1,
    "released_at":  "2026-09-28T12:00:00Z",
    "min_app_version_code":  1,
    "chapters":  [
                     {
                         "id":  "s1-c01",
                         "subject":  1,
                         "name":  "道路交通安全法律法规",
                         "order":  1
                     },
                     {
                         "id":  "s1-c02",
                         "subject":  1,
                         "name":  "交通信号",
                         "order":  2
                     }
                 ],
    "full":  {
                 "url":  "full/bank-v1.jsonl.gz",
                 "sha256":  "f6c70a31e9e1472a5c16d9435ff1a76c29785f4fb710d2a6f0a34c0a5bc24d9d",
                 "bytes":  927,
                 "count":  5
             },
    "deltas":  [

               ],
    "media_base":  "media/",
    "bundle":  {
                   "url":  "bundle/bundle-v2.zip",
                   "sha256":  "1438a7201ee6395e74fe020dc9c4813ee4febea0d858a317c09fd5aff1e8e791",
                   "bytes":  3527
               }
}